{
  "$schema": "./schemas/app.config.schema.json",
  "$version": "1.0",
  "companyName": "Your Company",
  "appName": "Enterprise Support",
  "appId": "com.enterprise.support",
  "appSubtitle": "IT Help & Documentation",
  "domain": "example.com",
  "vpnPortal": "vpn.example.com",
  "contacts": {
    "email": "ithelpdesk@example.com",
    "emergencyEmail": "security@example.com",
    "regions": [
      {
        "region": "Americas",
        "city": "Charlotte, NC (HQ)",
        "phone": "+1 (704) 805-7200",
        "hours": "7:00 AM - 7:00 PM EST"
      },
      {
        "region": "Americas",
        "city": "New York, NY",
        "phone": "+1 (212) 878-3600",
        "hours": "8:00 AM - 6:00 PM EST"
      },
      {
        "region": "EMEA",
        "city": "London, UK",
        "phone": "+44 20 7514 1000",
        "hours": "8:00 AM - 6:00 PM GMT"
      },
      {
        "region": "EMEA",
        "city": "Frankfurt, Germany",
        "phone": "+49 69 71690000",
        "hours": "8:00 AM - 6:00 PM CET"
      },
      {
        "region": "Asia Pacific",
        "city": "Hong Kong",
        "phone": "+852 2841 1000",
        "hours": "9:00 AM - 6:00 PM HKT"
      },
      {
        "region": "Asia Pacific",
        "city": "Tokyo, Japan",
        "phone": "+81 3 4578 7400",
        "hours": "9:00 AM - 6:00 PM JST"
      }
    ]
  },
  "features": {
    "tagFiltering": false,
    "pdfDocuments": true,
    "wordDocuments": true,
    "imageDocuments": true
  }
}
