{
  "$schema": "../schemas/app.config.schema.json",
  "$version": "1.0",
  "companyName": "StartupCo",
  "appName": "StartupCo Support",
  "appId": "com.startupco.support",
  "appSubtitle": "Quick IT Help",
  "domain": "startupco.io",
  "vpnPortal": "vpn.startupco.io",
  "contacts": {
    "email": "help@startupco.io",
    "emergencyEmail": "urgent@startupco.io"
  },
  "features": {
    "tagFiltering": false,
    "pdfDocuments": true,
    "wordDocuments": false,
    "imageDocuments": true
  }
}
